{
  "op3d_schema": "printer",
  "op3d_schema_version": "0.1.0",
  "id": "Anycubic/Vyper-2",
  "maintainer": {
    "name": "OpenPrint3D Community",
    "maintainer_type": "community",
    "website": "https://github.com/OpenPrint3D/OpenPrint3D"
  },
  "manufacturer": "Anycubic",
  "model": "Vyper 2",
  "variant": "Stock",
  "build_volume": { "x": 245, "y": 245, "z": 260, "shape": "rectangular", "origin": "front_left" },
  "kinematics": "bed_slinger",
  "axes": {
    "x": { "max_speed": 200, "max_accel": 1000 },
    "y": { "max_speed": 200, "max_accel": 1000 },
    "z": { "max_speed": 12, "max_accel": 100 }
  },
  "extruders": [{
    "id": "tool0",
    "nozzle_diameter": 0.4,
    "nozzle_material": "brass",
    "max_temp": 260,
    "min_temp": 170,
    "retraction_supported": true
  }],
  "bed": { "heated": true, "max_temp": 110, "surface_type": "PEI-textured" },
  "chamber": { "heated": false, "passive": false },
  "firmware": { "flavor": "marlin", "identifier": "Marlin 2.0.x (Anycubic)" },
  "network": { "has_wifi": true, "has_ethernet": false, "supports_lan_api": false },
  "links": {
    "product_page": "https://www.anycubic.com/products/vyper"
  },
  "tags": ["mid-range", "bed-slinger", "direct-drive", "auto-leveling", "high-speed"],
  "notes": "Anycubic Vyper 2. Upgraded version with improved speed and direct drive extruder. Features auto-leveling and whisper quiet stepper drivers.",
  "x_cura": {
    "definition": "anycubic_vyper2",
    "definition_changes": {
      "machine_width": 245,
      "machine_depth": 245,
      "machine_height": 260,
      "nozzle_size": 0.4,
      "heated_bed": true,
      "machine_heated_bed": true,
      "bed_temperature": 60,
      "nozzle_temperature": 200
    }
  },
  "x_prusaslicer": {
    "printer_model": "Vyper 2",
    "vendor": "Anycubic",
    "filament_diameter": 1.75,
    "nozzle_diameter": 0.4,
    "bed_shape": "rectangular",
    "bed_size": "245x245",
    "print_height": 260
  },
  "x_orca": {
    "machine_name": "Vyper 2",
    "machine_manufacturer": "Anycubic",
    "bed_x": 245,
    "bed_y": 245,
    "height": 260,
    "nozzle_diameter": 0.4,
    "filament_diameter": 1.75
  },
  "x_bambu": {
    "product_id": "anycubic_vyper2",
    "series": "Vyper",
    "support_lidar": false,
    "support_ams": false,
    "support_ams_lite": false
  }
}
