{
  "op3d_schema": "printer",
  "op3d_schema_version": "0.1.0",
  "id": "Artillery/Genius-3",
  "maintainer": {
    "name": "OpenPrint3D Community",
    "maintainer_type": "community",
    "website": "https://github.com/OpenPrint3D/OpenPrint3D"
  },
  "manufacturer": "Artillery",
  "model": "Genius 3",
  "variant": "Stock",
  "build_volume": { "x": 250, "y": 250, "z": 280, "shape": "rectangular", "origin": "front_left" },
  "kinematics": "corexy",
  "axes": {
    "x": { "max_speed": 500, "max_accel": 15000 },
    "y": { "max_speed": 500, "max_accel": 15000 },
    "z": { "max_speed": 15, "max_accel": 500 }
  },
  "extruders": [{
    "id": "tool0",
    "nozzle_diameter": 0.4,
    "nozzle_material": "hardened-steel",
    "max_temp": 300,
    "min_temp": 170,
    "retraction_supported": true
  }],
  "bed": { "heated": true, "max_temp": 120, "surface_type": "PEI-textured" },
  "chamber": { "heated": false, "passive": true },
  "firmware": { "flavor": "klipper", "identifier": "Artillery Genius 3 Firmware" },
  "network": { "has_wifi": true, "has_ethernet": false, "supports_lan_api": true },
  "links": {
    "product_page": "https://artillery3d.com/products/genius-3"
  },
  "tags": ["budget", "corexy", "direct-drive", "high-speed", "klipper", "silent-drivers"],
  "notes": "Artillery Genius 3. Upgraded CoreXY printer with 250x250x280mm build volume. Features Klipper firmware, direct drive extruder, TMC2209 silent steppers, and hardened steel nozzle up to 300Â°C.",
  "x_cura": {
    "definition": "artillery_genius3",
    "definition_changes": {
      "machine_width": 250,
      "machine_depth": 250,
      "machine_height": 280,
      "nozzle_size": 0.4,
      "heated_bed": true,
      "machine_heated_bed": true,
      "bed_temperature": 60,
      "nozzle_temperature": 200
    }
  },
  "x_prusaslicer": {
    "printer_model": "Genius 3",
    "vendor": "Artillery",
    "filament_diameter": 1.75,
    "nozzle_diameter": 0.4,
    "bed_shape": "rectangular",
    "bed_size": "250x250",
    "print_height": 280
  },
  "x_orca": {
    "machine_name": "Genius 3",
    "machine_manufacturer": "Artillery",
    "bed_x": 250,
    "bed_y": 250,
    "height": 280,
    "nozzle_diameter": 0.4,
    "filament_diameter": 1.75
  },
  "x_bambu": {
    "product_id": "artillery_genius3",
    "series": "Genius",
    "support_lidar": false,
    "support_ams": false,
    "support_ams_lite": false,
    "max_speed": 500,
    "nozzle_type": "hardened-steel"
  }
}
