{
  "op3d_schema": "printer",
  "op3d_schema_version": "0.1.0",
  "id": "Creality/CR-10-SE",
  "maintainer": {
    "name": "OpenPrint3D Community",
    "maintainer_type": "community",
    "website": "https://github.com/OpenPrint3D/OpenPrint3D"
  },
  "manufacturer": "Creality",
  "model": "CR-10 SE",
  "variant": "Stock",
  "build_volume": { "x": 300, "y": 300, "z": 400, "shape": "rectangular", "origin": "front_left" },
  "kinematics": "cartesian",
  "axes": {
    "x": { "max_speed": 300, "max_accel": 8000 },
    "y": { "max_speed": 300, "max_accel": 8000 },
    "z": { "max_speed": 10, "max_accel": 500 }
  },
  "extruders": [{
    "id": "tool0",
    "nozzle_diameter": 0.4,
    "nozzle_material": "brass",
    "max_temp": 260,
    "min_temp": 170,
    "retraction_supported": true
  }],
  "bed": { "heated": true, "max_temp": 110, "surface_type": "carborundum-glass" },
  "chamber": { "heated": false, "passive": false },
  "firmware": { "flavor": "marlin", "identifier": "Creality Marlin" },
  "network": { "has_wifi": false, "has_ethernet": false, "supports_lan_api": false },
  "links": {
    "product_page": "https://www.creality.com/products/cr-10-se"
  },
  "tags": ["large-format", "budget", "direct-drive", "high-speed"],
  "notes": "Creality CR-10 SE. Large format printer with direct drive extruder, CR-Touch auto-leveling, and capable of 300mm/s printing.",
  "x_cura": {
    "definition": "creality_cr10se",
    "definition_changes": {
      "machine_width": 300,
      "machine_depth": 300,
      "machine_height": 400,
      "nozzle_size": 0.4,
      "heated_bed": true,
      "machine_heated_bed": true,
      "bed_temperature": 60,
      "nozzle_temperature": 200
    }
  },
  "x_prusaslicer": {
    "printer_model": "CR-10 SE",
    "vendor": "Creality",
    "filament_diameter": 1.75,
    "nozzle_diameter": 0.4,
    "bed_shape": "rectangular",
    "bed_size": "300x300",
    "print_height": 400,
    "printer_technology": "FFF"
  },
  "x_orca": {
    "machine_name": "CR-10 SE",
    "machine_manufacturer": "Creality",
    "bed_x": 300,
    "bed_y": 300,
    "height": 400,
    "nozzle_diameter": 0.4,
    "filament_diameter": 1.75
  },
  "x_bambu": {
    "product_id": "creality_cr10se",
    "series": "CR-10",
    "support_lidar": false,
    "support_ams": false,
    "support_ams_lite": false
  }
}
