{
  "op3d_schema": "printer",
  "op3d_schema_version": "0.1.0",
  "id": "Sovol/SV18",
  "maintainer": {
    "name": "OpenPrint3D Community",
    "maintainer_type": "community",
    "website": "https://github.com/OpenPrint3D/OpenPrint3D"
  },
  "manufacturer": "Sovol",
  "model": "SV18",
  "variant": "Stock",
  "build_volume": { "x": 420, "y": 420, "z": 500, "shape": "rectangular", "origin": "front_left" },
  "kinematics": "corexy",
  "axes": {
    "x": { "max_speed": 600, "max_accel": 25000 },
    "y": { "max_speed": 600, "max_accel": 25000 },
    "z": { "max_speed": 25, "max_accel": 600 }
  },
  "extruders": [{
    "id": "tool0",
    "nozzle_diameter": 0.4,
    "nozzle_material": "hardened-steel",
    "max_temp": 350,
    "min_temp": 180,
    "retraction_supported": true
  }],
  "bed": { "heated": true, "max_temp": 130, "surface_type": "PEI-textured" },
  "chamber": { "heated": true, "max_temp": 60, "passive": true },
  "firmware": { "flavor": "klipper", "identifier": "Sovol SV18 Firmware" },
  "network": { "has_wifi": true, "has_ethernet": true, "supports_lan_api": true },
  "links": {
    "product_page": "https://sovol3d.com/products/sv18-3d-printer"
  },
  "tags": ["premium", "corexy", "direct-drive", "high-speed", "600mm-s", "extra-large-build", "350c-capable", "enclosed", "input-shaping", "heated-chamber"],
  "notes": "Sovol SV18. Extra-large-format flagship CoreXY with 420x420x500mm build volume, Klipper firmware with input shaping, up to 600mm/s speed, 350°C hotend, and active heated chamber up to 60°C. Fully enclosed design with air filtration.",
  "x_cura": {
    "definition": "sovol_sv18",
    "definition_changes": {
      "machine_width": 420,
      "machine_depth": 420,
      "machine_height": 500,
      "nozzle_size": 0.4,
      "heated_bed": true,
      "machine_heated_bed": true,
      "bed_temperature": 60,
      "nozzle_temperature": 200
    }
  },
  "x_prusaslicer": {
    "printer_model": "SV18",
    "vendor": "Sovol",
    "filament_diameter": 1.75,
    "nozzle_diameter": 0.4,
    "bed_shape": "rectangular",
    "bed_size": "420x420",
    "print_height": 500,
    "printer_technology": "FFF"
  },
  "x_orca": {
    "machine_name": "SV18",
    "machine_manufacturer": "Sovol",
    "bed_x": 420,
    "bed_y": 420,
    "height": 500,
    "nozzle_diameter": 0.4,
    "filament_diameter": 1.75,
    "kinematics": "corexy"
  },
  "x_bambu": {
    "product_id": "sovol_sv18",
    "series": "SV",
    "support_lidar": false,
    "support_ams": false,
    "support_ams_lite": true,
    "max_speed": 600,
    "nozzle_type": "hardened-steel",
    "max_temp": 350,
    "active_chamber_heating": true,
    "has_ethernet": true
  }
}
