{
  "op3d_schema": "printer",
  "op3d_schema_version": "0.1.0",
  "id": "Creality/Ender-3-S1-Plus",
  "maintainer": {
    "name": "OpenPrint3D Community",
    "maintainer_type": "community",
    "website": "https://github.com/OpenPrint3D/OpenPrint3D"
  },
  "manufacturer": "Creality",
  "model": "Ender-3 S1 Pro",
  "variant": "Stock",
  "build_volume": { "x": 220, "y": 220, "z": 270, "shape": "rectangular", "origin": "front_left" },
  "kinematics": "bed_slinger",
  "axes": {
    "x": { "max_speed": 150, "max_accel": 2000 },
    "y": { "max_speed": 150, "max_accel": 2000 },
    "z": { "max_speed": 12, "max_accel": 200 }
  },
  "extruders": [{
    "id": "tool0",
    "nozzle_diameter": 0.4,
    "nozzle_material": "hardened-steel",
    "max_temp": 300,
    "min_temp": 170,
    "retraction_supported": true
  }],
  "bed": { "heated": true, "max_temp": 110, "surface_type": "PEI-spring-steel" },
  "chamber": { "heated": false, "passive": false },
  "firmware": { "flavor": "marlin", "identifier": "Marlin 2.x (Creality)" },
  "network": { "has_wifi": false, "has_ethernet": false, "supports_lan_api": false },
  "links": {
    "product_page": "https://www.creality.com/products/ender-3-s1-plus"
  },
  "tags": ["mid-range", "direct-drive", "all-metal-hotend", "300c-capable", "cr-touch"],
  "notes": "Creality Ender-3 S1 Plus. Larger build volume (220x220x270), all-metal Sprite hotend for high-temp materials.",
  "x_cura": {
    "definition": "creality_ender3s1plus",
    "definition_changes": {
      "machine_width": 220,
      "machine_depth": 220,
      "machine_height": 270,
      "nozzle_size": 0.4,
      "heated_bed": true,
      "machine_heated_bed": true,
      "bed_temperature": 60,
      "nozzle_temperature": 200
    }
  },
  "x_prusaslicer": {
    "printer_model": "Ender-3 S1 Plus",
    "vendor": "Creality",
    "filament_diameter": 1.75,
    "nozzle_diameter": 0.4,
    "bed_shape": "rectangular",
    "bed_size": "220x220",
    "print_height": 270
  },
  "x_orca": {
    "machine_name": "Ender-3 S1 Plus",
    "machine_manufacturer": "Creality",
    "bed_x": 220,
    "bed_y": 220,
    "height": 270,
    "nozzle_diameter": 0.4,
    "filament_diameter": 1.75
  },
  "x_bambu": {
    "product_id": "creality_ender3s1plus",
    "series": "Ender",
    "support_lidar": false,
    "support_ams": false,
    "support_ams_lite": false
  }
}
