{
  "op3d_schema": "printer",
  "op3d_schema_version": "0.1.0",
  "id": "Creality/Ender-3-S1-Plus-0.6mm",
  "maintainer": {
    "name": "OpenPrint3D Community",
    "maintainer_type": "community",
    "website": "https://github.com/OpenPrint3D/OpenPrint3D"
  },
  "manufacturer": "Creality",
  "model": "Ender-3 S1 Plus",
  "variant": "0.6mm Nozzle",
  "build_volume": { "x": 300, "y": 300, "z": 340, "shape": "rectangular", "origin": "front_left" },
  "kinematics": "cartesian",
  "axes": {
    "x": { "max_speed": 120, "max_accel": 5000 },
    "y": { "max_speed": 120, "max_accel": 5000 },
    "z": { "max_speed": 12, "max_accel": 500 }
  },
  "extruders": [{
    "id": "tool0",
    "nozzle_diameter": 0.6,
    "nozzle_material": "brass",
    "max_temp": 260,
    "min_temp": 170,
    "retraction_supported": true
  }],
  "bed": { "heated": true, "max_temp": 100, "surface_type": "pei" },
  "chamber": { "heated": false, "max_temp": 100, "passive": true },
  "firmware": { "flavor": "marlin", "identifier": "Creality Ender-3 S1 Plus" },
  "network": { "has_wifi": false, "has_ethernet": false, "supports_lan_api": false },
  "links": {
    "product_page": "https://www.creality.com/pages/ender-3-s1-plus"
  },
  "tags": ["fdm", "cartesian", "direct-drive", "auto-leveling", "0.6mm", "large-build"],
  "notes": "Ender-3 S1 Plus with 0.6mm nozzle for faster printing on larger builds."
}
