{
  "op3d_schema": "printer",
  "op3d_schema_version": "0.1.0",
  "id": "BambuLab/A1-Mini-Combo",
  "maintainer": {
    "name": "OpenPrint3D Community",
    "maintainer_type": "community",
    "website": "https://github.com/OpenPrint3D/OpenPrint3D"
  },
  "manufacturer": "Bambu Lab",
  "model": "A1 Mini Combo",
  "variant": "Stock",
  "build_volume": { "x": 180, "y": 180, "z": 180, "shape": "rectangular", "origin": "front_left" },
  "kinematics": "bed_slinger",
  "axes": {
    "x": { "max_speed": 500, "max_accel": 15000 },
    "y": { "max_speed": 500, "max_accel": 15000 },
    "z": { "max_speed": 16, "max_accel": 400 }
  },
  "extruders": [
    { "id": "tool0", "nozzle_diameter": 0.4, "nozzle_material": "stainless-steel", "max_temp": 300, "min_temp": 170, "retraction_supported": true },
    { "id": "tool1", "nozzle_diameter": 0.4, "nozzle_material": "stainless-steel", "max_temp": 300, "min_temp": 170, "retraction_supported": true },
    { "id": "tool2", "nozzle_diameter": 0.4, "nozzle_material": "stainless-steel", "max_temp": 300, "min_temp": 170, "retraction_supported": true },
    { "id": "tool3", "nozzle_diameter": 0.4, "nozzle_material": "stainless-steel", "max_temp": 300, "min_temp": 170, "retraction_supported": true }
  ],
  "bed": { "heated": true, "max_temp": 80, "surface_type": "PEI-textured" },
  "chamber": { "heated": false, "passive": false },
  "firmware": { "flavor": "bambu", "identifier": "Bambu Lab proprietary" },
  "network": { "has_wifi": true, "has_ethernet": false, "supports_lan_api": true },
  "links": {
    "product_page": "https://bambulab.com/en/a1-mini"
  },
  "tags": ["compact", "budget", "high-speed", "ams-lite", "multi-color", "open-frame"],
  "notes": "Bambu Lab A1 Mini Combo. Compact bed-slinger with AMS Lite for multi-color printing up to 4 filaments. High-speed capability with open frame design. All-metal hotend.",
  "x_cura": {
    "definition": "bambulab_a1_mini_combo",
    "definition_changes": {
      "machine_width": 180,
      "machine_depth": 180,
      "machine_height": 180,
      "nozzle_size": 0.4,
      "heated_bed": true,
      "machine_heated_bed": true,
      "bed_temperature": 60,
      "nozzle_temperature": 200,
      "machine_extruder_count": 4
    }
  },
  "x_prusaslicer": {
    "printer_model": "A1 Mini Combo",
    "vendor": "Bambu Lab",
    "filament_diameter": 1.75,
    "nozzle_diameter": 0.4,
    "bed_shape": "rectangular",
    "bed_size": "180x180",
    "print_height": 180,
    "printer_technology": "FFF"
  },
  "x_orca": {
    "machine_name": "A1 Mini Combo",
    "machine_manufacturer": "Bambu Lab",
    "bed_x": 180,
    "bed_y": 180,
    "height": 180,
    "nozzle_diameter": 0.4,
    "filament_diameter": 1.75,
    "support_ams": false,
    "support_ams_lite": true
  },
  "x_bambu": {
    "product_id": "bambulab_a1_mini_combo",
    "series": "A1 Mini",
    "support_lidar": false,
    "support_ams": false,
    "support_ams_lite": true,
    "max_speed": 500,
    "nozzle_type": "stainless-steel"
  }
}
