{
  "op3d_schema": "printer",
  "op3d_schema_version": "0.1.0",
  "id": "Prusa/MK3S-Plus-Multi-Material",
  "maintainer": {
    "name": "OpenPrint3D Community",
    "maintainer_type": "community",
    "website": "https://github.com/OpenPrint3D/OpenPrint3D"
  },
  "manufacturer": "Prusa",
  "model": "MK3S+ Multi Material",
  "variant": "Stock",
  "build_volume": { "x": 250, "y": 210, "z": 210, "shape": "rectangular", "origin": "front_left" },
  "kinematics": "cartesian",
  "axes": {
    "x": { "max_speed": 200, "max_accel": 10000 },
    "y": { "max_speed": 200, "max_accel": 10000 },
    "z": { "max_speed": 12, "max_accel": 1000 }
  },
  "extruders": [
    {
      "id": "tool0",
      "nozzle_diameter": 0.4,
      "nozzle_material": "brass",
      "max_temp": 280,
      "min_temp": 180,
      "retraction_supported": true
    },
    {
      "id": "tool1",
      "nozzle_diameter": 0.4,
      "nozzle_material": "brass",
      "max_temp": 280,
      "min_temp": 180,
      "retraction_supported": true
    },
    {
      "id": "tool2",
      "nozzle_diameter": 0.4,
      "nozzle_material": "brass",
      "max_temp": 280,
      "min_temp": 180,
      "retraction_supported": true
    },
    {
      "id": "tool3",
      "nozzle_diameter": 0.4,
      "nozzle_material": "brass",
      "max_temp": 280,
      "min_temp": 180,
      "retraction_supported": true
    },
    {
      "id": "tool4",
      "nozzle_diameter": 0.4,
      "nozzle_material": "brass",
      "max_temp": 280,
      "min_temp": 180,
      "retraction_supported": true
    }
  ],
  "bed": { "heated": true, "max_temp": 100, "surface_type": "smooth-pei" },
  "chamber": { "heated": false, "passive": false },
  "firmware": { "flavor": "reprap", "identifier": "Prusa Firmware 3.13.x with MMU2S" },
  "network": { "has_wifi": true, "has_ethernet": false, "supports_lan_api": false },
  "links": {
    "product_page": "https://www.prusa3d.com/category/original-prusa-i3-mk3s-plus/",
    "mmu2s_page": "https://www.prusa3d.com/product/original-prusa-multi-material-2s/"
  },
  "tags": ["premium", "cartesian", "direct-drive", "multi-material", "mmu2s", "5-color"],
  "notes": "Prusa MK3S+ with MMU2S multi-material upgrade. Supports up to 5 filaments for multi-color printing. Same reliable CoreXY platform as MK3S+.",
  "x_cura": {
    "definition": "prusa_mk3splus_mmu",
    "definition_changes": {
      "machine_width": 250,
      "machine_depth": 210,
      "machine_height": 210,
      "nozzle_size": 0.4,
      "heated_bed": true,
      "machine_heated_bed": true,
      "bed_temperature": 60,
      "nozzle_temperature": 200,
      "extruder_count": 5
    }
  },
  "x_prusaslicer": {
    "printer_model": "MK3S+",
    "vendor": "Prusa",
    "filament_diameter": 1.75,
    "nozzle_diameter": 0.4,
    "bed_shape": "rectangular",
    "bed_size": "250x210",
    "print_height": 210,
    "printer_technology": "FFF",
    "mmu_enabled": true,
    "extruder_count": 5
  },
  "x_orca": {
    "machine_name": "MK3S+ Multi Material",
    "machine_manufacturer": "Prusa",
    "bed_x": 250,
    "bed_y": 210,
    "height": 210,
    "nozzle_diameter": 0.4,
    "filament_diameter": 1.75,
    "extruder_count": 5,
    "mmu_mode": true
  },
  "x_bambu": {
    "product_id": "prusa_mk3splus_mmu",
    "series": "MK3",
    "support_lidar": false,
    "support_ams": false,
    "support_ams_lite": false,
    "mmu_model": "MMU2S"
  }
}
