{
  "op3d_schema": "printer",
  "op3d_schema_version": "0.1.0",
  "id": "Artillery/Sidewinder-X3",
  "maintainer": {
    "name": "OpenPrint3D Community",
    "maintainer_type": "community",
    "website": "https://github.com/OpenPrint3D/OpenPrint3D"
  },
  "manufacturer": "Artillery",
  "model": "Sidewinder X3",
  "variant": "Plus",
  "build_volume": { "x": 300, "y": 300, "z": 400, "shape": "rectangular", "origin": "front_left" },
  "kinematics": "corexy",
  "axes": {
    "x": { "max_speed": 300, "max_accel": 6000 },
    "y": { "max_speed": 300, "max_accel": 6000 },
    "z": { "max_speed": 15, "max_accel": 300 }
  },
  "extruders": [{
    "id": "tool0",
    "nozzle_diameter": 0.4,
    "nozzle_material": "brass",
    "max_temp": 300,
    "min_temp": 170,
    "retraction_supported": true
  }],
  "bed": { "heated": true, "max_temp": 100, "surface_type": "PEI-magnetic" },
  "chamber": { "heated": false, "passive": false },
  "firmware": { "flavor": "marlin", "identifier": "Artillery Sidewinder X3 Firmware" },
  "network": { "has_wifi": true, "has_ethernet": false, "supports_lan_api": false },
  "links": {
    "product_page": "https://artillery3d.com/products/sidewinder-x3-plus"
  },
  "tags": ["corexy", "high-speed", "direct-drive", "large-build", "dual-z"],
  "notes": "Artillery Sidewinder X3 Plus. Large format CoreXY with 300x300x400mm build volume, dual Z-axis, and up to 300mm/s print speed.",
  "x_cura": {
    "definition": "artillery_sidewinder_x3",
    "definition_changes": {
      "machine_width": 300,
      "machine_depth": 300,
      "machine_height": 400,
      "nozzle_size": 0.4,
      "heated_bed": true,
      "machine_heated_bed": true,
      "bed_temperature": 60,
      "nozzle_temperature": 210
    }
  },
  "x_prusaslicer": {
    "printer_model": "Sidewinder X3",
    "vendor": "Artillery",
    "filament_diameter": 1.75,
    "nozzle_diameter": 0.4,
    "bed_shape": "rectangular",
    "bed_size": "300x300",
    "print_height": 400
  },
  "x_orca": {
    "machine_name": "Sidewinder X3",
    "machine_manufacturer": "Artillery",
    "bed_x": 300,
    "bed_y": 300,
    "height": 400,
    "nozzle_diameter": 0.4,
    "filament_diameter": 1.75
  },
  "x_bambu": {
    "product_id": "artillery_sidewinder_x3",
    "series": "Sidewinder",
    "support_lidar": false,
    "support_ams": false,
    "support_ams_lite": false
  }
}
