{
  "op3d_schema": "printer",
  "op3d_schema_version": "0.1.0",
  "id": "Prusa/XL-1-Tool",
  "maintainer": {
    "name": "OpenPrint3D Community",
    "maintainer_type": "community",
    "website": "https://github.com/OpenPrint3D/OpenPrint3D"
  },
  "manufacturer": "Prusa",
  "model": "XL 1-Tool",
  "variant": "Stock",
  "build_volume": { "x": 360, "y": 360, "z": 360, "shape": "rectangular", "origin": "front_left" },
  "kinematics": "corexz",
  "axes": {
    "x": { "max_speed": 250, "max_accel": 10000 },
    "y": { "max_speed": 250, "max_accel": 10000 },
    "z": { "max_speed": 25, "max_accel": 1000 }
  },
  "extruders": [
    { "id": "tool0", "nozzle_diameter": 0.4, "nozzle_material": "brass", "max_temp": 290, "min_temp": 180, "retraction_supported": true }
  ],
  "bed": { "heated": true, "max_temp": 120, "surface_type": "smooth-pei" },
  "chamber": { "heated": false, "max_temp": 45, "passive": true },
  "firmware": { "flavor": "reprap", "identifier": "Prusa Firmware 5.x" },
  "network": { "has_wifi": true, "has_ethernet": true, "supports_lan_api": true },
  "links": {
    "product_page": "https://www.prusa3d.com/category/original-prusa-xl/"
  },
  "tags": ["premium", "corexz", "single-tool", "1-tool", "large-format", "nextruder", "segmented-bed"],
  "notes": "Prusa XL single toolhead configuration. CoreXZ kinematics with Nextruder direct drive extruder. Build volume 360x360x360mm with segmented heatbed (16 independently controlled zones). Max nozzle temp 290Â°C with brass nozzle.",
  "x_cura": {
    "definition": "prusa_xl_1tool",
    "definition_changes": {
      "machine_width": 360,
      "machine_depth": 360,
      "machine_height": 360,
      "nozzle_size": 0.4,
      "heated_bed": true,
      "machine_heated_bed": true,
      "bed_temperature": 80,
      "nozzle_temperature": 210
    }
  },
  "x_prusaslicer": {
    "printer_model": "XL",
    "vendor": "Prusa",
    "filament_diameter": 1.75,
    "nozzle_diameter": 0.4,
    "bed_shape": "rectangular",
    "bed_size": "360x360",
    "print_height": 360,
    "printer_technology": "FFF"
  },
  "x_orca": {
    "machine_name": "XL 1-Tool",
    "machine_manufacturer": "Prusa",
    "bed_x": 360,
    "bed_y": 360,
    "height": 360,
    "nozzle_diameter": 0.4,
    "filament_diameter": 1.75,
    "support_ams": false,
    "multi_tool": false,
    "tool_count": 1
  },
  "x_bambu": {
    "product_id": "prusa_xl_1tool",
    "series": "XL",
    "support_lidar": false,
    "support_ams": false,
    "support_ams_lite": false,
    "active_chamber_heating": true,
    "multi_tool": false,
    "tool_count": 1
  }
}
