{
  "op3d_schema": "printer",
  "op3d_schema_version": "0.1.0",
  "id": "Sidewinder/X4",
  "maintainer": {
    "name": "OpenPrint3D Community",
    "maintainer_type": "community",
    "website": "https://github.com/OpenPrint3D/OpenPrint3D"
  },
  "manufacturer": "Artillery",
  "model": "Sidewinder X4",
  "variant": "Stock",
  "build_volume": { "x": 350, "y": 350, "z": 400, "shape": "rectangular", "origin": "front_left" },
  "kinematics": "corexy",
  "axes": {
    "x": { "max_speed": 600, "max_accel": 20000 },
    "y": { "max_speed": 600, "max_accel": 20000 },
    "z": { "max_speed": 20, "max_accel": 800 }
  },
  "extruders": [{
    "id": "tool0",
    "nozzle_diameter": 0.4,
    "nozzle_material": "hardened-steel",
    "max_temp": 320,
    "min_temp": 170,
    "retraction_supported": true
  }],
  "bed": { "heated": true, "max_temp": 120, "surface_type": "PEI-textured" },
  "chamber": { "heated": false, "passive": true },
  "firmware": { "flavor": "klipper", "identifier": "Artillery Sidewinder X4 Firmware" },
  "network": { "has_wifi": true, "has_ethernet": true, "supports_lan_api": true },
  "links": {
    "product_page": "https://artillery3d.com/products/sidewinder-x4"
  },
  "tags": ["large-format", "corexy", "direct-drive", "high-speed", "klipper", "ethernet", "enclosed"],
  "notes": "Artillery Sidewinder X4. Large-format CoreXY with 350x350x400mm build volume. Features Klipper firmware, enclosed chamber, direct drive extruder, 320Â°C max nozzle temp, and Ethernet connectivity.",
  "x_cura": {
    "definition": "artillery_sidewinder_x4",
    "definition_changes": {
      "machine_width": 350,
      "machine_depth": 350,
      "machine_height": 400,
      "nozzle_size": 0.4,
      "heated_bed": true,
      "machine_heated_bed": true,
      "bed_temperature": 60,
      "nozzle_temperature": 200
    }
  },
  "x_prusaslicer": {
    "printer_model": "Sidewinder X4",
    "vendor": "Artillery",
    "filament_diameter": 1.75,
    "nozzle_diameter": 0.4,
    "bed_shape": "rectangular",
    "bed_size": "350x350",
    "print_height": 400
  },
  "x_orca": {
    "machine_name": "Sidewinder X4",
    "machine_manufacturer": "Artillery",
    "bed_x": 350,
    "bed_y": 350,
    "height": 400,
    "nozzle_diameter": 0.4,
    "filament_diameter": 1.75
  },
  "x_bambu": {
    "product_id": "artillery_sidewinder_x4",
    "series": "Sidewinder",
    "support_lidar": false,
    "support_ams": false,
    "support_ams_lite": false,
    "max_speed": 600,
    "nozzle_type": "hardened-steel",
    "has_ethernet": true
  }
}
