{
  "op3d_schema": "printer",
  "op3d_schema_version": "0.1.0",
  "id": "Peopoly/Phenom",
  "maintainer": {
    "name": "OpenPrint3D Community",
    "maintainer_type": "community",
    "website": "https://github.com/OpenPrint3D/OpenPrint3D"
  },
  "manufacturer": "Peopoly",
  "model": "Phenom",
  "variant": "Stock",
  "build_volume": { "x": 384, "y": 216, "z": 300, "shape": "rectangular", "origin": "center" },
  "kinematics": "msla",
  "axes": {
    "x": { "max_speed": 100, "max_accel": 1000 },
    "y": { "max_speed": 100, "max_accel": 1000 },
    "z": { "max_speed": 30, "max_accel": 300 }
  },
  "extruders": [{
    "id": "tool0",
    "nozzle_diameter": 0.035,
    "nozzle_material": "stainless-steel",
    "max_temp": 30,
    "min_temp": 20,
    "retraction_supported": false
  }],
  "bed": { "heated": true, "max_temp": 50, "surface_type": "fep" },
  "chamber": { "heated": false, "passive": false },
  "firmware": { "flavor": "other", "identifier": "Peopoly Firmware" },
  "network": { "has_wifi": false, "has_ethernet": false, "supports_lan_api": false },
  "links": {
    "product_page": "https://www.peopoly.net/products/phenom"
  },
  "tags": ["msla", "large-format", "resin", "huge-build"],
  "notes": "Peopoly Phenom. Large format MSLA 3D printer with massive 384x216x300mm build volume. Features 35-micron resolution, FEP film, and large build area for industrial applications.",
  "x_cura": {
    "definition": "peopoly_phenom",
    "definition_changes": {
      "machine_width": 384,
      "machine_depth": 216,
      "machine_height": 300,
      "nozzle_size": 0.035,
      "heated_bed": true,
      "printer_technology": "MSLA"
    }
  },
  "x_prusaslicer": {
    "printer_model": "Phenom",
    "vendor": "Peopoly",
    "filament_diameter": 1.75,
    "nozzle_diameter": 0.035,
    "bed_shape": "rectangular",
    "bed_size": "384x216",
    "print_height": 300
  },
  "x_orca": {
    "machine_name": "Phenom",
    "machine_manufacturer": "Peopoly",
    "bed_x": 384,
    "bed_y": 216,
    "height": 300,
    "nozzle_diameter": 0.035,
    "filament_diameter": 1.75
  },
  "x_bambu": {
    "product_id": "peopoly_phenom",
    "series": "Phenom",
    "support_lidar": false,
    "support_ams": false,
    "support_ams_lite": false
  }
}
