{
  "op3d_schema": "printer",
  "op3d_schema_version": "0.1.0",
  "id": "Anycubic/Vyper-Pro",
  "maintainer": {
    "name": "OpenPrint3D Community",
    "maintainer_type": "community",
    "website": "https://github.com/OpenPrint3D/OpenPrint3D"
  },
  "manufacturer": "Anycubic",
  "model": "Vyper Pro",
  "variant": "Stock",
  "build_volume": { "x": 300, "y": 300, "z": 350, "shape": "rectangular", "origin": "front_left" },
  "kinematics": "corexy",
  "axes": {
    "x": { "max_speed": 500, "max_accel": 20000 },
    "y": { "max_speed": 500, "max_accel": 20000 },
    "z": { "max_speed": 20, "max_accel": 500 }
  },
  "extruders": [{
    "id": "tool0",
    "nozzle_diameter": 0.4,
    "nozzle_material": "hardened-steel",
    "max_temp": 300,
    "min_temp": 170,
    "retraction_supported": true
  }],
  "bed": { "heated": true, "max_temp": 120, "surface_type": "PEI-textured" },
  "chamber": { "heated": false, "passive": true },
  "firmware": { "flavor": "klipper", "identifier": "Anycubic Vyper Pro Firmware" },
  "network": { "has_wifi": true, "has_ethernet": false, "supports_lan_api": true },
  "links": {
    "product_page": "https://www.anycubic.com/products/vyper-pro"
  },
  "tags": ["high-speed", "corexy", "direct-drive", "500mm-s", "klipper", "enclosed", "input-shaping", "auto-leveling"],
  "notes": "Anycubic Vyper Pro. Upgraded CoreXY version of Vyper with Klipper firmware, input shaping, 500mm/s max speed, hardened steel nozzle, and enclosed build chamber. Touchscreen with Wi-Fi connectivity.",
  "x_cura": {
    "definition": "anycubic_vyperpro",
    "definition_changes": {
      "machine_width": 300,
      "machine_depth": 300,
      "machine_height": 350,
      "nozzle_size": 0.4,
      "heated_bed": true,
      "machine_heated_bed": true,
      "bed_temperature": 60,
      "nozzle_temperature": 200
    }
  },
  "x_prusaslicer": {
    "printer_model": "Vyper Pro",
    "vendor": "Anycubic",
    "filament_diameter": 1.75,
    "nozzle_diameter": 0.4,
    "bed_shape": "rectangular",
    "bed_size": "300x300",
    "print_height": 350,
    "printer_technology": "FFF"
  },
  "x_orca": {
    "machine_name": "Vyper Pro",
    "machine_manufacturer": "Anycubic",
    "bed_x": 300,
    "bed_y": 300,
    "height": 350,
    "nozzle_diameter": 0.4,
    "filament_diameter": 1.75,
    "kinematics": "corexy"
  },
  "x_bambu": {
    "product_id": "anycubic_vyperpro",
    "series": "Vyper",
    "support_lidar": false,
    "support_ams": false,
    "support_ams_lite": false,
    "max_speed": 500,
    "nozzle_type": "hardened-steel"
  }
}